{
  "$canon_version": "CANON.02",
  "namespace": "GC",
  "meta": {
    "created_at": "2026-06-20T00:00:00Z",
    "updated_at": "2026-07-01T16:54:47Z",
    "allocation_authority": "jj-ervin",
    "namespace_file": "passes/namespace.yaml",
    "layers_file": "passes/layers.yaml",
    "changelog_file": "passes/passes.registry.changelog.jsonl",
    "canon_version": "CANON.02",
    "external_registries": [
      {
        "namespace": "ECO",
        "registry_url": "../eco/passes/passes.registry.json"
      }
    ]
  },
  "entries": [
    {
      "id": "GC:0001",
      "alias": "GC.00",
      "legacy_ids": [],
      "title": "Governance Commons Ecosystem Charter",
      "description": "Founding charter of the Governance Commons ecosystem. Declares purpose, scope, authority model, and the relationship between GC standards and adopting namespaces.",
      "layer": "authority",
      "cluster": "GC",
      "parent": null,
      "status": "accepted",
      "timestamp": "2026-06-05T00:00:00Z",
      "path": "docs/charter.md",
      "supersedes": [],
      "superseded_by": null,
      "depends_on": [],
      "originating_pass": "CANON.03"
    },
    {
      "id": "GC:1001",
      "alias": "APO.00",
      "legacy_ids": [],
      "title": "Agent Project Orchestrator — Cluster Header",
      "description": "Founding record of the APO cluster. Governs the Agent Project Orchestrator protocol: how agents coordinate multi-project work, handoff governance, and orchestration contracts.",
      "layer": "operational",
      "cluster": "APO",
      "parent": null,
      "status": "accepted",
      "timestamp": "2026-06-05T00:00:00Z",
      "path": "agent-project-orchestrator/DEV-PATH.md",
      "supersedes": [],
      "superseded_by": null,
      "depends_on": [],
      "originating_pass": "CANON.03"
    },
    {
      "id": "GC:1002",
      "alias": "ATP.00",
      "legacy_ids": [],
      "title": "Agent Team Protocol — Cluster Header",
      "description": "Founding record of the ATP cluster. Governs multi-agent team coordination: role assignment, communication protocols, and team-level governance contracts.",
      "layer": "operational",
      "cluster": "ATP",
      "parent": null,
      "status": "accepted",
      "timestamp": "2026-06-05T00:00:00Z",
      "path": "agent-team-protocol/",
      "supersedes": [],
      "superseded_by": null,
      "depends_on": [],
      "originating_pass": "CANON.03"
    },
    {
      "id": "GC:2001",
      "alias": "CANON.00",
      "legacy_ids": [],
      "title": "Canonical PASS Identifier Standard — Cluster Header",
      "description": "Founding record of the CANON cluster. Declares the canonical PASS identifier system: format, alias model, immutability, layer grammar, registry model, external adopter model, and bootstrap acknowledgment. Establishes 8 cluster invariants.",
      "layer": "standards",
      "cluster": "CANON",
      "parent": null,
      "status": "accepted",
      "timestamp": "2026-06-20T00:00:00Z",
      "path": "passes/canon/CANON.00.md",
      "supersedes": [],
      "superseded_by": null,
      "depends_on": [],
      "originating_pass": "CANON.03"
    },
    {
      "id": "GC:2002",
      "alias": "CANON.01",
      "legacy_ids": [],
      "title": "PASS Identifier Governance — Normative Specification",
      "description": "Normative PASS identifier governance specification. Declares canonical ID grammar (ABNF), ONS conformance, namespace declaration spec (namespace.yaml), layers declaration spec, alias model, allocation authority model, sub-pass relationship model, and immutability specification. 37 normative rules.",
      "layer": "standards",
      "cluster": "CANON",
      "parent": "GC:2001",
      "status": "accepted",
      "timestamp": "2026-06-20T00:00:00Z",
      "path": "passes/canon/CANON.01.md",
      "supersedes": [],
      "superseded_by": null,
      "depends_on": ["GC:2001"],
      "originating_pass": "CANON.03"
    },
    {
      "id": "GC:2003",
      "alias": "CANON.02",
      "legacy_ids": [],
      "title": "Registry Governance — Normative Specification",
      "description": "Normative registry governance specification. Declares registry file format, entry schema (14 required fields), status taxonomy, write authority enforcement, schema validation contract, append-only changelog, CI integration contract, and dependency validation. 44 normative rules. Companion JSON Schema published at schemas/canon-registry-entry.schema.json.",
      "layer": "standards",
      "cluster": "CANON",
      "parent": "GC:2001",
      "status": "accepted",
      "timestamp": "2026-06-20T00:00:00Z",
      "path": "passes/canon/CANON.02.md",
      "supersedes": [],
      "superseded_by": null,
      "depends_on": ["GC:2001", "GC:2002"],
      "originating_pass": "CANON.03"
    },
    {
      "id": "GC:2004",
      "alias": "CANON.03",
      "legacy_ids": [],
      "title": "Migration Protocol — eco and GC First-Adopter",
      "description": "Migration protocol for the ECO: and GC: namespaces as CANON first-adopters. Formally reverses the unauthorized named-cluster-only rule. Declares ECO: and GC: namespaces and layer bands. Declares assignment algorithm, legacy ID mapping, and conflict resolution rules. Assigns canonical IDs to CANON, ONS, ACES, OG, RT, EV, OPS, REM, APO, ATP clusters. Resolves CANON bootstrap condition.",
      "layer": "standards",
      "cluster": "CANON",
      "parent": "GC:2001",
      "status": "accepted",
      "timestamp": "2026-06-20T00:00:00Z",
      "path": "passes/canon/CANON.03.md",
      "supersedes": [],
      "superseded_by": null,
      "depends_on": ["GC:2001", "GC:2002", "GC:2003"],
      "originating_pass": "CANON.03"
    },
    {
      "id": "GC:2005",
      "alias": "ONS.00",
      "legacy_ids": [],
      "title": "Ontic Namespace Structure — Canonical Naming Grammar",
      "description": "Founding record of the ONS cluster. Declares the Ontic Namespace Structure canonical naming grammar for eco and GC-conformant systems. Governs identifier formation, qualification authority, and naming conformance.",
      "layer": "standards",
      "cluster": "ONS",
      "parent": null,
      "status": "accepted",
      "timestamp": "2026-04-11T00:00:00Z",
      "path": "../eco/passes/ons/ONS.00.md",
      "supersedes": [],
      "superseded_by": null,
      "depends_on": [],
      "originating_pass": "CANON.03"
    },
    {
      "id": "GC:2006",
      "alias": "ONS.01",
      "legacy_ids": [],
      "title": "ONS Lint Rule Catalog and Naming Enforcement",
      "description": "Declares the ONS lint rule catalog: machine-checkable naming rules derived from the ONS grammar. Governs CI enforcement of naming conformance.",
      "layer": "standards",
      "cluster": "ONS",
      "parent": "GC:2005",
      "status": "accepted",
      "timestamp": "2026-06-03T16:34:47Z",
      "path": "../eco/passes/ons/ONS.01.md",
      "supersedes": [],
      "superseded_by": null,
      "depends_on": ["GC:2005"],
      "originating_pass": "CANON.03"
    },
    {
      "id": "GC:2007",
      "alias": "ONS.02",
      "legacy_ids": [],
      "title": "ONS Python AST Naming Enforcement",
      "description": "Declares ONS enforcement for Python codebases via AST analysis. Governs how Python identifier conformance is checked against the ONS grammar.",
      "layer": "standards",
      "cluster": "ONS",
      "parent": "GC:2005",
      "status": "accepted",
      "timestamp": "2026-06-04T03:42:30Z",
      "path": "../eco/passes/ons/ONS.02.md",
      "supersedes": [],
      "superseded_by": null,
      "depends_on": ["GC:2005", "GC:2006"],
      "originating_pass": "CANON.03"
    },
    {
      "id": "GC:2008",
      "alias": "DEV-ACCORD.00",
      "legacy_ids": [],
      "title": "Planning Document Standard — Cluster Header",
      "description": "Founding record of the DEV-ACCORD cluster. Declares the canonical planning doc types (DEV-PATH, DEV-PLAN, DEV-RELEASE, DEV-TRACKS), H1 naming rule with em dash separator, canonical doc rule, append-only constraint for DEV-PATH, and validation contract enforced by validate-planning.ps1.",
      "layer": "standards",
      "cluster": "DEV-ACCORD",
      "parent": null,
      "status": "accepted",
      "timestamp": "2026-06-27T00:00:00Z",
      "path": "passes/dev-accord/DEV-ACCORD.00.md",
      "supersedes": [],
      "superseded_by": null,
      "depends_on": ["GC:2005"],
      "originating_pass": "DEV-ACCORD.00"
    },
    {
      "id": "GC:2009",
      "alias": "DEV-ACCORD.01",
      "legacy_ids": [],
      "title": "Planning Document Standard — ONS Registration",
      "description": "Registers the four canonical planning doc types (DEV-PATH, DEV-PLAN, DEV-RELEASE, DEV-TRACKS) in the ONS namespace. Adds portfolio_doc_name casing domain and portfolio namespace domain to ons.yaml; creates ons/registry/doc-types.yaml.",
      "layer": "standards",
      "cluster": "DEV-ACCORD",
      "parent": "GC:2008",
      "status": "accepted",
      "timestamp": "2026-06-27T00:00:00Z",
      "path": "passes/dev-accord/DEV-ACCORD.01.md",
      "supersedes": [],
      "superseded_by": null,
      "depends_on": ["GC:2008"],
      "originating_pass": "DEV-ACCORD.01"
    },
    {
      "id": "GC:2010",
      "alias": "DEV-ACCORD.02",
      "legacy_ids": [],
      "title": "Execution Model — PASS, RUN, and Evidence Bundle",
      "description": "Defines the three-layer execution model: PASS (governance contract), RUN (execution event), Evidence Bundle (audit record). Governing doctrine for all agents operating under GC governance.",
      "layer": "standards",
      "cluster": "DEV-ACCORD",
      "parent": "GC:2008",
      "status": "accepted",
      "timestamp": "2026-06-28T00:00:00Z",
      "path": "passes/dev-accord/DEV-ACCORD.02.md",
      "supersedes": [],
      "superseded_by": null,
      "depends_on": ["GC:2008"],
      "originating_pass": "DEV-ACCORD.02"
    },
    {
      "id": "GC:2011",
      "alias": "DEV-ACCORD.03",